[
  {
    "code": "synthetic_reason_one",
    "family": "synthetic_evidence",
    "severity": "low",
    "summary_key": "verdict.reason.synthetic_reason_one",
    "observed_at": "2000-01-01T00:00:01Z",
    "freshness": "current"
  },
  {
    "code": "synthetic_reason_one",
    "family": "synthetic_evidence",
    "severity": "low",
    "summary_key": "verdict.reason.synthetic_reason_one",
    "observed_at": "2000-01-01T00:00:01Z",
    "freshness": "current"
  }
]
